<?xml version="1.0" encoding="UTF-8"?>
<!DOCTYPE vm SYSTEM "vm.dtd">
<vm name="Children" root="test/path/to/root/">
  <binaryOptions>
    <configurationOption>
      <name>root</name>
      <children>
        <options>X</options>
        <options>Y</options>
        <options>Z</options>
      </children>
      <optional>False</optional>
    </configurationOption>
    <configurationOption>
      <name>X</name>
      <parent>root</parent>
      <optional>True</optional>
    </configurationOption>
    <configurationOption>
      <name>Y</name>
      <parent>root</parent>
      <optional>True</optional>
    </configurationOption>
    <configurationOption>
      <name>Z</name>
      <parent>root</parent>
      <optional>True</optional>
    </configurationOption>
  </binaryOptions>
  <numericOptions/>
</vm>
