<?xml version="1.0" encoding="UTF-8"?>
<!DOCTYPE vm SYSTEM "vm.dtd">
<vm name="ABC" root="test/path/to/root/" commit="DABAD00">
  <binaryOptions>
    <configurationOption>
      <name>root</name>
      <children>
        <options>A</options>
        <options>B</options>
        <options>C</options>
      </children>
      <optional>False</optional>
    </configurationOption>
    <configurationOption>
      <name>A</name>
      <parent>root</parent>
      <children>
        <options>AA</options>
        <options>AB</options>
        <options>AC</options>
      </children>
      <optional>False</optional>
      <locations>
        <sourceRange>
          <path>main.c</path>
          <start>
            <line>6</line>
            <column>3</column>
          </start>
          <end>
            <line>6</line>
            <column>26</column>
          </end>
        </sourceRange>
      </locations>
    </configurationOption>
    <configurationOption>
      <name>AA</name>
      <parent>A</parent>
      <excludedOptions>
        <options>AC</options>
        <options>C</options>
      </excludedOptions>
      <optional>False</optional>
    </configurationOption>
    <configurationOption>
      <name>AB</name>
      <parent>A</parent>
      <excludedOptions>
        <options>AC</options>
      </excludedOptions>
      <optional>False</optional>
    </configurationOption>
    <configurationOption>
      <name>AC</name>
      <parent>A</parent>
      <excludedOptions>
        <options>AB</options>
      </excludedOptions>
      <optional>False</optional>
    </configurationOption>
    <configurationOption>
      <name>B</name>
      <parent>root</parent>
      <children>
        <options>N</options>
      </children>
      <optional>True</optional>
    </configurationOption>
    <configurationOption>
      <name>C</name>
      <parent>root</parent>
      <excludedOptions>
        <options>AA</options>
      </excludedOptions>
      <optional>True</optional>
    </configurationOption>
  </binaryOptions>
  <numericOptions>
    <configurationOption>
      <name>N</name>
      <parent>B</parent>
      <optional>True</optional>
      <values>1;5;9</values>
    </configurationOption>
  </numericOptions>
  <booleanConstraints/>
</vm>
